Username,#Post,#Followers,Last_Photo,Phone_1,Phone_2,Phone_3,Biography,Link
otono_store,"1,415","4,198",28-Jun-18,3122895699,,,Tienda de Accesorios Creatividad y Exclusividad Escribenos Wps 3122895699 Domicilios en Medellin Envíos Nacionales Entrega Segura,api.whatsapp.com/send?phone=573122895699
onix_tienda,124,"1,305",1-Jun-18,3002041068,,,Accesorios y Moda  WhatsApp 3002041068 Medellín  Colombia   csagudelmgmailcom a class hrefexploretagsonixtiendaOnixTiendaa,instagram.com/onix_tienda
personnalitebk,"11,632","5,337",28-Jun-18,3186624431,,,Tienda Fisica llena de Personalidad  Originales  a Todo el Pais   318 662 4431  3007016023 Cll 49a class hrefexploretags1818a67 CC Crystalos Barrancabermeja,www.facebook.com/PersonnaliteRegalosOriginales
sandramartinez1306,164,232,31-May-18,,,3182899626,Tienda Virtual de Bolsos Zapatos y Accesorios de Dama hechos a mano Envíos a todo el país y sin costo en Medellín Escríbenos al Whatsapp,api.whatsapp.com/send?phone=573182899626
milujoyas,"2,229","11,491",28-Jun-18,3165301183,,,Carvalleta accesorios principal centro comercial hueco número uno local 102 WhatsApp info  57 3165301183   enlace directo  Pagos en bitcoin,api.whatsapp.com/send?phone=573165301183
valu_store01,190,502,28-Jun-18,3217651052,,,Somos una empresa confiable  comercializadora de perfumes  y variedades wpp 3217651052 Envigado Medellín  Envíos nacionales ,No link
illusiondesign488,151,"1,689",28-Jun-18,,,,Por la gracia de Dios soy lo que soy   MAS QUE UNA MARCA UN ESTILO  Venezuela Envíos nacionales  e internacionales  wsp 584261009532,No link
gice_correa,240,666,19-Jun-18,,,,Accesorios hechos con amor Venta al por mayor y al detal MedellinBogotá ,No link
gotadulce_accesorios,603,"2,278",28-Jun-18,3014415520,3105121741,,GOTA DULCE ACCESORIOS   gotadulceaccesoriosoutlookes 57 3014415520  3105121741  snapchat gotadulceacces  Cali  Colombia,No link
shopaddict.med,374,"1,007",29-May-18,,,3183817210,envios  nacionales  pagos efectivoapp Bancolombia DaviPlata CUENTA ALIADA a classnotranslate hrefalbedriodesignalbedriodesigna LINK DIRECTO WHATSAPP,api.whatsapp.com/send?phone=573183817210
a.manoycon.amor,25,24,29-May-18,,,,Accesorios HECHOS A MANO Y CON AMOR Diseñamos y creamos para ti elaboramos lo que tengas en mente Los mejores detalles para tus dias especiales,No link
anellijoyas,85,"1,577",27-Jun-18,,,, Elegancia   Diseño  Calidad WhatsApp 8112126679 Envíos a todo México,anelli.com.mx/categoria-producto/churumbelas
accesoriostruelove,156,279,28-May-18,3228804365,,,INF WhatsApp 322 880 4365 Medellín ENV Colombia   by a classnotranslate hrefmarilynpmejiamarilynpmejiaa,m.facebook.com/accesoriostruelove801
florrosaaccesorios,49,139,28-May-18,3154830376,,,TIENDA VIRTUAL MEDELLÍN ANT COMPRA  SEGURA FOTOS REALES  Pedidos whatsapp 3154830376 ,No link
alhajas_de_papel,68,356,4-Jun-18,3146666240,,,TALLER CREATIVO ALHAJAS DE PAPEL está dedicado al diseño y creación de piezas de Joyería artesanal y decoración en papel Contacto 57 3146666240,www.facebook.com/alhajasdepapel
novumed,23,129,28-May-18,,,,Tienda Virtual  Info al dm   Vive Sueña Innova Crea,No link
rutaboutique,50,236,29-Jun-18,3002040075,,,Envíos a todo Colombia Info whatssap 3002040075,No link
thepalmshop,489,"3,407",25-May-18,3148040524,,, The Palm Shop  Tienda Virtual Domicilios en Medellin y Envíos al resto del País  Medellin  Colombia  WhatsApp 314 804 05 24,No link
pasion_store,"2,531","3,940",25-May-18,3012922353,,,MI SOCIO ES DIOS ENVÍOS NACIONALES 3012922353 VENTAS X MAYOR Y AL DETAL MEDELLIN  a classnotranslate hrefpasionstorepasionstorea a class hrefexploretagspasionstorepasionstorea,api.whatsapp.com/send?phone=573012922353
bombom_by_laura,294,"1,702",27-Jun-18,3005144545,,,Tienda de ropa y accesorios  envios a todo el pais Contacto whatsapp3005144545 Ventas al por mayor y al detal,No link
espiritulibre.co,314,676,28-Jun-18,3104901881,,,By Jacke Guzmán Para espíritus libres y bellos como el tuyo Ventas al por mayor y al detal Pedidos por WS  3104901881 Envigado,No link
hipercelcom,110,100,15-Jun-18,,,,Equipos libres todas las marcas pedidos al por mayor y al detal Envíos  a todo destino nacional,No link
laguiadesincelejo,344,"5,654",28-Jun-18,,,,Directorio y Magazine virtual de la Ciudad y sus alrededores  Turismo Negocios Planes Concursos Cultura y mucho más  Muy pronto versión 30,www.laguiadesincelejo.com
rianadisk,"2,316","5,140",28-Jun-18,3114536075,,,Boutique de Prendas amp Accesorios Exclusivos a classnotranslate hrefaccesoriosinfiniteaccesoriosinfinitea Tu Diseñas Tu Vida Riana Tu Estilo Contáctanos 3114536075 Envíos Nacionales,No link
liris_co,10,76,22-May-18,,,,No biography,No link
kai_accesories_,31,76,28-Jun-18,,,,amor  arte  originalidad KAI accesories  unimos ideas hasta lograr el resultado deseado  pregunta por DM cómo adquirir tu producto,No link
tazel.co,64,229,11-Jun-18,3116162031,,,Multi Brand Store  3116162031                                   Medelliín Colombia,No link
mariaemmaaccesorios,12,61,18-Jun-18,3148112384,,,Somos Lo Que Hacen Nuestras Manos 3148112384 Medellín ,No link
ropayregalosmedellin,146,970,26-Jun-18,,,3042036929,Tienda virtual de ropa y variedades  Domicilios en Medellin Envíos a todo el país 100 seguros LINK DIRECTO WHATSAPP,api.whatsapp.com/send?phone=573042036929
orosantoaccesorios,8,57,27-May-18,3226896923,,,Empresa  Colombia venta al detal y al por mayor  Domicilios en Medellín  Envios a todo el país  Inf 3226896923,No link
corazondecorazon,48,"2,503",28-Jun-18,3122586687,,,Ventas al por mayor  Envíos a todo Colombia  Contacto 312 2586687  Estamos en Medellín  Accesorios para todos los gustos,No link
yalilia_ac,19,49,12-May-18,,,,Venta de hermosos collares a muy buen precio Más información y Domicilios en Medellin al Direct  BIENVENIDAS,No link
prestigio.mtp,359,"5,891",26-Jun-18,,,3206348219,Accesorios con mucho prestigio a class hrefexploretagsyosoyprestigioyosoyprestigioa Complementa todos tus outfits Envigado  Colombia Wapp directo ,api.whatsapp.com/send?phone=573206348219
alquilerdevestidoscamelia,236,"3,336",28-Jun-18,3182723709,,, Alquiler de vestidos amp Boutique de ropa   479 51 55  Cita solo para vestidos  1000 am 700 pm  318 272 3709 Enlace,api.whatsapp.com/send?phone=573182723709&amp;text=Bienvenido
beyou_accesorios,81,"3,452",19-Jun-18,,,, Whatsapp584245045842 Envíos Nacionales e Internacionales                 Zoom y DHL PayPalPayoneerZelle BarquisimetoVenezuela,www.beyouaccesorios.com.ve
modafitnesscol,"1,258","17,795",28-Jun-18,3122895699,,,Ropa Deportiva  Wps 3122895699 Envíos NACIONALES  INTERNACIONALES Entrega Segura   Medellín,api.whatsapp.com/send?phone=3122895699
petraaccesorio,15,57,26-Jun-18,3013457433,3108495389,, Accesories are like friesYou cant just have one  Ciudades Medellín  Pereira   WhatsAppMed 3013457433 Pei 3108495389   Envíos nacionales,No link
elrebujodemartace,33,48,4-Jun-18,,,,Joyería y muchas artesanías más a class hrefexploretagsaccesoriesaccesoriesa a class hrefexploretagsaccesoriosaccesoriosa a class hrefexploretagsjoyeriajoyeriaa a class hrefexploretagsartesaniasartesaniasa,No link
oxma.accesorios,183,"2,340",22-Jun-18,3206236478,,, 57 320 623 6478  MedellínColombia  Domicilios  a class hrefexploretagsoxmaaccesoriosOxmaAccesoriosa,www.Facebook.com/oxma.accesorios
jennys_shop_medellin,347,"28,585",7-Apr-18,3226643769,,,Ventas virtuales Entrega Inmediata Calidad garantizada Domicilios a nivel nacional Wpp 3226643769 Pago contra entrega,No link
bralette_desire,267,"10,475",25-Jun-18,3045472588,,,Tienda virtual   Ventas al por mayor y al detal  Bralettes desde 15000 2x50000 Todos los conjuntos Medellín Colombia  3045472588 a classnotranslate hrefmanuvelartmanuvelarta,No link
_esmeraldascolombia,306,"38,781",28-Jun-18,3147198811,,,Colombian Emeralds Directamente desde las minas a classnotranslate hrefesmeraldascolombiaesmeraldascolombiaa WhatssApp 3147198811,www.esmeraldascolombia.com
vendetumoto.co,240,"46,829",28-Jun-18,,,3057508454, Pauta tu MotoCuatrimotoUTVAccesorios en venta con nosotros   Colombia Escríbenos al WhatsApp,api.whatsapp.com/send?phone=573057508454
dinamo_social_store_,16,"1,908",25-Jun-18,,,3128751138,Productos  Originales Envíos a toda Colombia   Social network store  Escríbenos ,api.whatsapp.com/send?phone=573128751138
nati.shop4,137,265,27-Jun-18,3208788355,,,Tienda online  domiciliosORIGINAL Y REPLICA sólo whatsApp 3208788355,No link
sugarcraft.col,626,"2,532",28-Jun-18,3057256656,,, sugarcraftcolgmailcom   57 305 725 66 56  037 5 83 89 66  Atención personalizada  Envíos nacionales  Escribenos al whatsapp,api.whatsapp.com/send?phone=573057256656&amp;text=Bienvenido
vellstore_oficial,"24,810",826,29-Jun-18,,,,Visitanos  también en wwwfacebookcomvellstore,www.vellstore.com
pinchadas,"1,756","13,049",28-Jun-18,3203966461,,,Moda creativa zapatos psicodélicos Vestidos glamurosos en venta y Alquiler Ropa niñosTrajes Europeos4 5119411  320 3966461  Medellin,No link
importados_el_enano,8,284,28-Jun-18,3176046796,,,SUPLEMENTOS amp VITAMINAS Domicilios en MEDELLÍN   y envíos en todo  Informes 3176046796 PRODUCTOS ORIGINALES AMERICANOS ,No link
spiceshop1,620,264,28-Jun-18,3006587600,3046395379,,Tienda On Line Envíos a nivel nacional   confiable  Info al WhatsApp  3006587600 3046395379,No link
dcishop,"13,302","8,107",28-Jun-18,3044254790,,,a classnotranslate hrefDcishopDcishopa  Calzado Importado What 57 3044254790 envíos todo el paísCOLOMBIA ,No link
urban29store,658,858,27-Jun-18,3006961136,,,Tienda virtual  Medellin  Ventas al por mayor y al detal  Domicilios en Medellin Info Direct  o Wpp 3006961136 100 Confiables ,No link
xtreme__suplementos_medellin,654,"18,913",28-Jun-18,3127602283,,,Baja de peso con los mejores quemadores de grasa  envíos a todo el país  WSP3127602283 cambiado vidas y habitos preguntame como,No link
tudescansocolombia,32,"1,229",28-Jun-18,3438788623,,,Tu Descanso  Colchones amp Muebles Somos fabricantes directos con materiales  CALIDAD GARANTIZADA by Colchones Platino 0343878862  3007433521,No link
jfgstore,784,"2,211",28-Jun-18,3127816132,3103889404,,TenisRelojes Lociones  3127816132 3103889404 Entregas a domicilio en el valle de aburra Envíos seguros a toda Colombia,No link
labodegamedellin1,208,"2,006",29-Jun-18,3147358859,,,Ventas solo al Detal  WhatsApp 3147358859 No llamadas  Domicilios y envíos Envíos seguros a todo el pais WHATSAPP DIRECT ,api.whatsapp.com/send?phone=573147358859
labodegamedellin,"5,943","70,158",29-Jun-18,3147358859,,,Ventas solo al Detal  WhatsApp 3147358859 No llamadas  Domicilios y envíos Envíos seguros a todo el pais WHATSAPP DIRECT ,api.whatsapp.com/send?phone=573147358859
tennis__envigado,673,326,28-Jun-18,,,301692635,TENNIS TODAS LAS MARCAS TIENDA VIRTUAL DOMICILIOS A TODO MEDELLIN  VENTA AL POR MAYOR Y AL DETAL  TENNIS IMPORTADOS AAA a classnotranslate hreftennisenvigadotennisenvigadoa,www.facebook.com/Tennis-Envigado-1284081301692635
manto.thestore,775,"1,097",28-Jun-18,3127961003,,,  TIENDA VIRTUAL        a class hrefexploretagsropaRopaa  a class hrefexploretagsaccesoriosAccesoriosa  a class hrefexploretagszapatosZapatosa   a class hrefexploretagscarterasCarterasa  a class hrefexploretagsgafasGafasa  Pedidos 3127961003 ENLACE DIRECTO A WP,api.whatsapp.com/send?phone=573127961003
lanapatienda,"1,548","1,223",28-Jun-18,,,3016858768,Un Mercado de muchos artículos a su disposición con facilidades de pago Anímense y charlamosa classnotranslate hreflalaañapatienda,api.whatsapp.com/send?phone=573016858768
lipoblue_advance_medellin,529,"191,713",29-Jun-18,3126626021,,,recibes el mismo dia en MEDELLIN   LLÁMANOS  O ESCRIBE       312 662 60 21 clic en este Link para ir directo al whats,api.whatsapp.com/send?phone=573126626021
moon_tienda_,"1,665","11,724",28-Jun-18,3054364876,,,Medellin TIENDA VIRTUAL Envíos nacionales  De 10 am 8 pm Ventas al detal y al por mayor Wapp3054364876 FABRICANTES Todas tus dudas acá ,api.whatsapp.com/send?phone=573054364876
creeseingecarq,66,557,28-Jun-18,3167424170,,,Mayor información  3167424170  5897997 a classnotranslate hrefcreeseinmobiliaria2017creeseinmobiliaria2017a,No link
maissa_accesorios,146,358,28-Jun-18,3217628896,,,El arte de ser mujer Accesorios y complementos femeninos Somos tienda virtual en Medellin Pedidos al wapp 3217628896 Envios  seguros,No link
cese_style,67,307,28-Jun-18,3022471155,,,Cese Style  Tienda VirtualElegancia sensualidad y exclusividad  Ropa informal  y deportiva  Sebastián Giraldo 3022471155,No link
camisetasclothingcali,"1,043","2,736",29-Jun-18,3107111847,,,Cali  Colombia  Venta de ropa al Mayor y Detal  Envios a nivel nacional  Zapatillas a classnotranslate hrefjrsportcalijrsportcalia  Compras vía WhatsApp 573107111847,api.whatsapp.com/send?phone=573107111847&amp;text=hola%2C+proveedor+%2Acamisetasclothingcali%2A+me+encuentro+interesad%40+
cafe1907medellin,"1,126","5,779",29-Jun-18,3226166583,,,Tostamos a class hrefexploretagscafe1907medellinCafe1907medellina  Colombia Tostadoras de lecho fluido que garantizan que el a class hrefexploretagscafecafea se tueste  de una manera uniformewhatsapp 3226166583,toroj201601.wixsite.com/cafe-1907
_the_shopping_medellin,"1,646","11,469",28-Jun-18,3002359704,,,estás en the shoppingmedellin tienda virtual wpp 3002359704  domicilios en Medellín y envíos a todo el pais  escríbenos  link directo,api.whatsapp.com/send?phone=573002359704
bestsellerkids,301,"4,426",28-Jun-18,3193519605,,,BestSeller kids WhatsApp 3193519605  Tienda de ropa infantil en Cali domicilios y recogida en nuestro local Villacolombia Envios nacionales,No link
pipemayaventas,440,"30,118",29-Jun-18,3105363010,,,Ventas de talmayor 57 3105363010  Medellín Colombia   Pipe Maya Ventas  a classnotranslate hrefpipemayaventaspipemayaventasa  a classnotranslate hrefpipemaya1pipemaya1a   seguro  Envíos a todo el país ,api.whatsapp.com/send?phone=573105363010
loliando_lm,489,"2,750",29-Jun-18,3113755468,,,Rocking clothestopsearrings amp more MedellínColombia Envíos y domicilios  Whatsapp 3113755468 Catálogo Ropa ,myalbum.com/album/2EJPX0uepfGq
luxurystoremedellin,199,"6,356",27-Jun-18,3016113367,,,Ventas al detal y por mayor   Whatsapp 3016113367 Ubicado en Medellín Colombia   Instagram a classnotranslate hrefluxurystoremedellinluxurystoremedellina   seguro,api.whatsapp.com/send?phone=573016113367
elclickshop,324,"46,453",28-Jun-18,3008421418,,,Tecnologia y hobbies productos Nuevos Para información precios direct y whatsapp 57 300 842 1418 domicilios en medellin envíos a toda ,www.tiendaelclickshop.com
mayoristasvictoriasecret,511,"3,353",28-Jun-18,3208040113,,,Ventas por mayor Victorias Secret y PINK Compras  garantizadas hacemos envíos a todo Colombia  cuenta minorista a classnotranslate hrefbomboshellstorebomboshellstorea WA3208040113,No link
companyshop_,27,"8,357",29-Jun-18,,,,MedellinColombia Perfumeria  original y garantizada Compras seguras Envíos a todo el país Contra entrega en medellin Mayor amp detal,No link
romanticwishboutique,466,"7,485",28-Jun-18,3103723651,,,Ropa americana para dama confiableinfo 3103723651  5740340 ventas al por mayor y al detal Cc metrópolis local 110somos importadores directos,No link
luxurybrandsmedellin,3,10,27-Jun-18,3016113367,,,Ventas al detal y por mayor   Whatsapp 3016113367 Ubicado en Medellín Colombia   Instagram a classnotranslate hrefluxurystoremedellinluxurystoremedellina   seguro,No link
repro_max,267,"3,053",28-Jun-18,3136830656,,,Especialistas en electrónica automotriz mejoramos el sistema de inyección  Medellín  313 6830656 Barranquilla 301 6054220 Manizales  313 6303320,Repro-max.com
mosh_tennis,51,57,27-Jun-18,,,,Tienda virtual de tennis Atendemos tu pedido de forma rapida calzado nacional e importado Domicilios en medellin Envios a toda colombia,No link
fesita_ov,176,"1,231",28-Jun-18,3045246555,,,Outlet virtual Ventas al por mayor Y detal Domicilio en Medellín y al resto del país Contacto de WhatsApp  57 3045246555 a class hrefexploretagsfesitaFesitaa,No link
perfumes_mundoaroma,114,"6,674",28-Jun-18,3213540573,,,Medellin  pago contraentrega          PerfumesRéplicas finas 11  LÍNEA ÚNICA WHATSAPP  3213540573 Tienda Online  Segura Compra en línea,api.whatsapp.com/send?phone=573213540573
medellinfit_,159,"4,248",28-Jun-18,3006879513,,,SUPLEMENTOSampVITAMINAS Envíos a toda  DOMICILIOS MEDELLÍN ENVIGADO  SABANETA TAGUI   Originales  3006879513  ClickWHATSAPP,api.whatsapp.com/send?phone=573006879513
angeluna.accesorios,198,204,27-Jun-18,3166698852,3207367254,,Accesorios para dama caballero y hogar Ventas al por mayor y al detal somos fabricantes  Pedidos 3166698852  3207367254 Entregas a domicilio,No link
venustiendavirtual,673,"2,041",28-Jun-18,3128104163,,,Tienda inspirada en la mujer  Hecho en Colombia Envíos a todo el país  seguros Domicilios en Medellín  Pedidos al WhatsApp  3128104163,No link
calzadostar_,"3,211","11,363",28-Jun-18,3148094361,,,Envíos a todo Colombia INFO 3148094361  WhatsApp A SOLO UN CLICK ,api.whatsapp.com/send?phone=573148094361
horustoredyc,"1,260","1,714",27-Jun-18,3005014990,,,Productos 100 ORIGINALES Nacionales e importados 57 3005014990 Domicilios Gratis en MedellínEnvíos a toda Colombia,No link
modayaccesoriosnd,"1,436","7,433",28-Jun-18,3013060901,,,Ropa femenina Somos fabricantes Envíos a todo el país WhatsApp301 3060901 NO TIENDA FÍSICATODO SOBRE PEDIDO,api.whatsapp.com/send?phone=573013060901
espiritudelmarbw,130,710,27-Jun-18,,,,El bienestar del mar empieza en tu hogar Joyería y accesorios inspirados en la fauna marina los colores del océano y la naturaleza Medellín Col,No link
dolcecherrypijamas,37,"2,689",28-Jun-18,3015964583,,,Venta de hermosas pijamas desde 11500  Al por mayor y al detal Envíos  seguros MedellínColombia  solo Whatsapp 3015964583,No link
casastudioboutique,28,"22,790",27-Jun-18,,,,Im a trend Tienda Virtual Envíos 100 seguros Pagos conteaentrega en Medellín Espéranos pronto  a class hrefexploretagstiendacreadapensandoentiTiendacreadapensandoentia ENVÍOS A TODA COLOMBIA,No link
ines.momentosconamor,325,"1,460",27-Jun-18,3218538115,,,Que me traes    Amormucho amor  Una bonita forma de dar amor   Regalitos  Desayunos sorpresa  Plantitas  a class hrefexploretagsdesayunosmedellindesayunosmedellina   321 853 8115,No link
anaix_belleza_y_salud,54,193,28-Jun-18,3127602283,,,WSP3127602283 tenemos para ti Los mejores del mercado ULTRAZX LIPOBLUE NITROFIT NEXT ULTRAZX GOLD OBX a classnotranslate hrefanaixbellezaysaludanaixbellezaysaluda,No link
aromafresa,184,"15,229",28-Jun-18,3213540573,,,PerfumesRéplicas finas 11 Medellin  pago contraentrega     NUEVA LÍNEA ÚNICA WHATSAPP3213540573 Tienda Online  Segura Compra en línea,api.whatsapp.com/send?phone=573213540573
alma.violeta,244,"1,874",28-Jun-18,3117162864,,,Ventas solo al Detal  WhatsApp 3117162864 No llamadas  Domicilios y envíos  Envíos seguros a todo el pais WHATSAPP DIRECT ,api.whatsapp.com/send?phone=573117162864
malanochestore,923,"11,368",28-Jun-18,3023163148,,,Independent brandDark Clothing  Bogotáenvíos a toda Colombia SHIP WORLDWIDE on Etsy Designer a classnotranslate hrefElizabethatesElizabethatesa ComprasWhatsapp 3023163148,www.etsy.com/es/shop/MalaNocheStore
angel_virtualstore,262,"1,678",29-Jun-18,3016790037,,,Joyas en oro laminado18k Tienda virtual Colombia  Wpp 3016790037  No llamar  Bancolombia  Efecty  Envíos a todo el país  seguros,No link
mugsmedellin,312,"2,861",29-Jun-18,,,3022716852, Personalízalos como tú quieras  Venta detal y por mayor  Domicilio en Medellín   Pago contraentrega  Click para WhatsApp,api.whatsapp.com/send?l=es&amp;phone=573022716852
elalmacendefercho,7,14,27-Jun-18,3104305465,,,WhatSapp 310 4305465 Ventas de Productos de belleza importados y muchos mas de buena calidad,No link
peregrinosboutique,583,"1,100",28-Jun-18,3137545855,3142877471,,By Hogar de paso Peregrinos lo que compras aquí ayuda a unos Gatitos emprendedores Envíos nacionales Compra segura 3137545855 3142877471 Medellín Co,No link
ac_variedad,607,"1,548",26-Jun-18,,,3148231909,Aquí encontrarás muchas variedades para todos los gustos  Envíos en Colombia WhatsApp a un solo clik,api.whatsapp.com/send?phone=573148231909&amp;text=hola%2C+que+tal%3F
lipoblue.advance.medellin,97,"72,396",28-Jun-18,,,3108954126,a class hrefexploretagslipobluemedellinlipobluemedellina a class hrefexploretagslipoblueoriginallipoblueoriginala a class hrefexploretagslipoblueadvancelipoblueadvancea a class hrefexploretagsmedellinmedellina Clic en link para dirigirte a mi whats directamente,api.whatsapp.com/send?phone=573108954126
ventasjasa,48,351,28-Jun-18,3002362062,,,no llamadas  sólo whatsapp 3002362062  o directo 247 envíos a todo el país ,No link
urbanwear.we,220,"3,906",29-Jun-18,3044891629,,,Tienda virtual  Porque lo que usas también define tú actitud Envios a todo Colombia  Whatsapp   3044891629 Admina classnotranslate hrefelyperez01elyperez01a,www.facebook.com/urbanwear.we
importshopjj2,252,"2,805",28-Jun-18,3212949960,,,   321 2949960 Sigue  a class hrefexploretagsimporjjimporjja Tiendanbsp  virtual ROPA IMPORTADA  LINK DIRECTO A NUESTRO WHATSAPP ,api.whatsapp.com/send?phone=573212949960
advance_lipoblue,"3,063","125,269",28-Jun-18,,,3223024131,  Clic para dirigir directo al whats ,api.whatsapp.com/send?phone=573223024131
gothamstorecolombia,715,"2,212",28-Jun-18,3014013554,,,Los mejores productos al mejor precio  Envíos nacionales  Recibimos tarjetas   Ventas al por mayor y detal  Whatsapp 57 3014013554,No link
hfsolucionestecnologicas,13,122,26-Jun-18,3157882859,,,Tienda Virtual  OFRECEMOS PARA TI Venta y Mantenimiento PC Venta e Instalación de Cámaras CCTV  Whatsapp 57 315 7882859,No link
mkvirtualtienda,"1,184","47,186",28-Jun-18,,,,tienda virtual  ofrecemos productos de la mejor calidad  a los mejores precios DOMICILIOS GRATIS EN MEDELLÍN envío a todo COLOMBIAa classnotranslate hrefmkvirtualtiendamkvirtualtiendaa,No link
globaltechnoclothing,88,263,28-Jun-18,,,,Culture clothes de a classnotranslate hrefglobaltechnomusicglobaltechnomusica alusiva a la escena del TECHNO y TECHHOUSE  Servicio a domicilio y envíos a todo el país,www.facebook.com/Global-Techno-Music-149222488887260
sagradarose,58,"2,247",26-Jun-18,3104212683,,,Fabricamos tus zapatos Tienda virtual de accesorios exclusivos Envíos a toda Colombia ubicados en Medellín  info 3104212683,No link
marcerojostore,447,547,28-Jun-18,3136987124,,,TIENDA VIRTUAL by a classnotranslate hrefmarcerojomarcerojoa Ventas al Detal y Por Mayor Excelente Calidad WhatsApp 3136987124 Domicilios en Medellín  Envíos Colombia  Segur,No link
joseluis.torrealba.a,"1,534","22,058",26-Jun-18,3015822044,,,Abriendo fronteras con Dios Numerologo Tarotista Conferencista  Whatsap 573015822044 a class hrefexploretagsjoseluisnumerologojoseluisnumerologoa,api.whatsapp.com/send?phone=573015822044&amp;text=INTERESADOCONSULTA
dubenlab,"1,229","1,941",26-Jun-18,,,,Siempre Radiante Siempre Bella Siempre Duben Whastapp ,bit.ly/2IZ7iCA
p1storee,23,205,26-Jun-18,3213629659,,,Sudaderas a d i d a s  N i k e Execelnte calidad a los mejores precios  Variedad En Tallas  wpp 321 362 9659  e n v i o s,No link
medellingold,61,695,26-Jun-18,3185547545,3005959916,3347694411,ORO 18K a class hrefexploretagsluxurylivingluxurylivinga a class hrefexploretagsgoldgolda  Servicio a domicilio Envios nacionales  Contacto a classnotranslate hrefdeozzzdeozzza a classnotranslate hrefcristianbetancurcristianbetancura 3185547545 3005959916,www.facebook.com/Medellin-Gold-Store-164843347694411
lipobluee_medellin,"3,443","203,668",28-Jun-18,3222161028,,, Todo lo que necesitas mujer Envíos a todo destino  Whatsapp 322 216 10 28 Clic para dirigirte a mi wpp,api.whatsapp.com/send?phone=573222161028
vanesalazarventas1,109,297,26-Jun-18,,,,Producto a la venta,No link
soportcam,"2,598","3,722",28-Jun-18,3224825,,,VENTA E INSTALACIÓN Soportes TVMallas de Seguridad Cortinas Persianas Tendederos plegables 57 4 3224825  Whatsapp solo tocar el link siguiente,bit.ly/SoportcamWhatsapp
kingstore.tienda,"3,676",661,27-Jun-18,3023902935,,, Medellín  El Retiro  Antioquia  TIENDA VIRTUAL  Envios a nivel nacional   Por mayor y detal   700   WhatsApp3023902935,No link
maderocr,316,"1,864",28-Jun-18,3003968037,,,AQUÍ se Sueña Imagina y Crea   Wapp 3003968037  Medellín Colombia,No link
tinacollection.co,12,63,26-Jun-18,,,,No biography,No link
mielmostaza.col,872,"3,437",26-Jun-18,3012000250,,,Dulzura en cada paso Diseñada para mujeres que disfrutan siendo autenticas siendo ellas  VENTAS XMA Y DETAL Ws3012000250 Facebook a classnotranslate hrefktliosktliosa,m.facebook.com/mielmostaza.col
sermed_salud,113,"1,326",28-Jun-18,3052946824,,,Encuentra aquí  variedad de productos para el cuidado de tu cuerpo y tu saludenviamos a todo el país  Whatsapp 3052946824,No link
videoshollywood,88,"10,710",26-Jun-18,,,,New YorkColombiaJ DARREN ENTERPRISES,No link
junglacases,180,"1,054",28-Jun-18,3002751832,,, TIENDA VIRTUAL    Encuentra el case perfecto para tu iPhone  WhatsApp 300 275 1832301 204 0836  8am  8pm,No link
shanti_tienda_virtual,169,238,27-Jun-18,,,,a class hrefexploretagsbisuteriabisuteriaa a class hrefexploretagsrelojesrelojesa a class hrefexploretagsropadeportivaropadeportivaa a class hrefexploretagspijamaspijamasa a class hrefexploretagslenceríalenceríaa a class hrefexploretagsbolsosbolsosa a class hrefexploretagsmorralesmorralesa a class hrefexploretagsshantitiendavirtualshantitiendavirtuala,bit.ly/WhatsAppShantiTiendaVirtual
aprovarpropiedadraiz,98,779,26-Jun-18,,,3053390684,20 Años de Experiencia Administración de Propiedad Horizontal y Venta de propiedad Raíz ofrecemos servicios integrales en el sector inmobiliario,api.whatsapp.com/send?phone=573053390684
vboutique8,135,105,26-Jun-18,,,,No biography,No link
shoponceonce,299,366,29-Jun-18,3045472658,,,MedellinANTIOQUIA Bienvenids a Shoponceonce  Variedad que complementa tus gustos  WhatsApp 3045472658 a class hrefexploretagsshop1111shop1111a,No link
